{
  "apiVersion": "openexit.dev/v1alpha1",
  "kind": "Inventory",
  "metadata": {
    "project": "output",
    "source": "datadog",
    "collectedAt": "2026-05-27T04:39:06.856654339Z",
    "collectorVersion": "0.1.0-dev"
  },
  "source": {
    "type": "datadog",
    "site": "datadoghq.eu"
  },
  "assets": {
    "dashboards": [
      {
        "id": "abc-123",
        "title": "Production API Overview",
        "url": "https://app.datadoghq.eu/dashboard/abc-123",
        "tags": [
          "env:prod",
          "team:platform"
        ],
        "widgets": {
          "total": 2,
          "unsupported": 1,
          "types": [
            "note",
            "timeseries"
          ]
        },
        "queries": [
          {
            "id": "abc-123-query-1",
            "language": "datadog",
            "raw": "sum:trace.http.request.errors{env:prod}.as_count()"
          },
          {
            "id": "abc-123-query-2",
            "language": "datadog",
            "raw": "avg:system.cpu.user{env:prod} by {service}"
          }
        ],
        "evidenceRef": "evidence://datadog/dashboard/abc-123"
      }
    ],
    "monitors": [
      {
        "id": "123456",
        "name": "High error rate",
        "type": "query alert",
        "query": "sum(last_5m):avg:trace.http.request.errors{env:prod} \u003e 10",
        "notificationTargets": [
          "@slack-platform",
          "slack-platform"
        ],
        "tags": [
          "env:prod",
          "team:platform"
        ],
        "runbookUrl": "https://runbooks.example.invalid/high-error-rate",
        "evidenceRef": "evidence://datadog/monitor/123456"
      },
      {
        "id": "789012",
        "name": "Latency anomaly",
        "type": "query alert",
        "query": "avg(last_15m):anomalies(avg:trace.http.request.duration{env:prod}, 'basic', 2) \u003e= 1",
        "notificationTargets": [
          "@webhook-custom",
          "webhook-custom"
        ],
        "tags": [
          "env:prod"
        ],
        "evidenceRef": "evidence://datadog/monitor/789012"
      }
    ],
    "slos": [
      {
        "id": "slo-123",
        "name": "API availability",
        "target": 99.9,
        "timeframe": "30d",
        "evidenceRef": "evidence://datadog/slo/slo-123"
      }
    ],
    "integrations": [
      {
        "name": "kubernetes",
        "enabled": true,
        "tags": [
          "env:prod"
        ],
        "evidenceRef": "evidence://datadog/integration/kubernetes"
      }
    ],
    "metrics": [
      {
        "name": "system.cpu.user",
        "tags": [
          "env",
          "service"
        ]
      },
      {
        "name": "trace.http.request.duration",
        "tags": [
          "env"
        ]
      },
      {
        "name": "trace.http.request.errors",
        "tags": [
          "env",
          "service"
        ]
      }
    ]
  },
  "summary": {
    "dashboards": 1,
    "monitors": 2,
    "slos": 1,
    "integrations": 1,
    "uniqueMetrics": 3,
    "notificationTargets": 4
  },
  "volumes": {}
}